{
  "result_id": "IP-AI-DEBT-THEME-20260928-01",
  "mode": "theme",
  "generated_at": "2026-09-28T10:21:20Z",
  "observation_window": {
    "start": "2026-08-30",
    "end": "2026-09-28"
  },
  "theme_context": {
    "theme_name": "AI 发债扩张",
    "core_question": "AI相关大型科技企业是否扩大债券融资，扩张的用途、期限与承接情况如何，哪些证据支持或削弱融资压力解释？",
    "core_variables": [
      "debt_issuance",
      "maturity_profile",
      "market_absorption",
      "funding_cost",
      "funding_gap",
      "funding_diversification",
      "liquidity_buffer"
    ],
    "common_driver": "研究假设：数据中心与AI投资增加融资需求；须逐主体核验资金用途。",
    "open_questions": [
      "总发行扩张是否也意味着净融资增加？",
      "供给能否在合理定价下完成？",
      "有多少融资属于AI专项，而非一般公司用途？"
    ]
  },
  "search_log": [
    {
      "query": "CPRAM：What impact is hyperscaler bond issuance having on bond markets?",
      "source": "https://cpram.com/lux/en/individual/publications/experts/article/what-impact-is-hyperscaler-bond-issuance-having-on-bond-markets",
      "accessed_at": "2026-09-28T10:21:20Z",
      "status": "success",
      "detail": "A spectacular surge in bond issuance；文章发布日期不是明确的发行统计截止日。 本库数据摘录：sources/webpages/2026-09-28-ai-debt-theme/cpr-source-data.json"
    },
    {
      "query": "Goldman Sachs：How AI Debt Is Reshaping Credit Markets",
      "source": "https://www.goldmansachs.com/insights/goldman-sachs-exchanges/how-ai-debt-is-reshaping-the-credit-market",
      "accessed_at": "2026-09-28T10:21:20Z",
      "status": "success",
      "detail": "访谈中发行规模、保险客户订单与 new issue concessions 段落；统计不等于上半年同比。 本库数据摘录：sources/webpages/2026-09-28-ai-debt-theme/gs-source-data.json"
    },
    {
      "query": "TwentyFour AM：How hyperscaler issuance is reshaping the Treasury curve",
      "source": "https://blog.twentyfouram.com/insights/how-hyperscaler-issuance-is-reshaping-the-treasury-curve",
      "accessed_at": "2026-09-28T10:21:20Z",
      "status": "success",
      "detail": "Demand has been strong overall 段落；不同发行日且整体市场均值不是匹配30年期限对照。 本库数据摘录：sources/webpages/2026-09-28-ai-debt-theme/tf-source-data.json"
    },
    {
      "query": "Amazon：2026-09-09 英镑票据募集说明书补充文件 424B5",
      "source": "https://www.sec.gov/Archives/edgar/data/1018724/000110465926107122/tm2624614-3_424b5.htm",
      "accessed_at": "2026-09-28T10:21:20Z",
      "status": "success",
      "detail": "封面、S-4、USE OF PROCEEDS；用途包含多种公司用途，没有逐笔AI专用金额。 本库数据摘录：sources/webpages/2026-09-28-ai-debt-theme/amzn-source-data.json"
    },
    {
      "query": "Oracle：截至2026-08-31季度 Form 10-Q",
      "source": "https://www.sec.gov/Archives/edgar/data/1341439/000119312526389274/orcl-20260831.htm",
      "accessed_at": "2026-09-28T10:21:20Z",
      "status": "success",
      "detail": "现金流量表、Free cash flow 表、现金变动解释及资产负债表；现金流包含带重大融资成分的客户预付款。 本库数据摘录：sources/webpages/2026-09-28-ai-debt-theme/orcl-source-data.json"
    },
    {
      "query": "ECB Blog：Big tech, big debt: when US tech giants tap the euro area bond market",
      "source": "https://www.ecb.europa.eu/press/blog/date/2026/html/ecb.blog20260831~dac6a37e73.en.html",
      "accessed_at": "2026-09-28T10:21:20Z",
      "status": "success",
      "detail": "Is there a risk of crowding-out?；Chart 3；Conclusion。观察截至8月20日，不能当9月28日实时结论。 本库数据摘录：sources/webpages/2026-09-28-ai-debt-theme/ecb-source-data.json"
    },
    {
      "query": "AI hyperscaler bond issuance September 2026 Oracle Alphabet Meta bonds",
      "source": "Web Search",
      "accessed_at": "2026-09-28T10:21:20Z",
      "status": "success",
      "detail": "发现机构及监管原始资料，排除社交媒体主张；仅经打开核对的资料进入证据。"
    },
    {
      "query": "Financing the AI build-out",
      "source": "https://www.ubp.com/en/news-insights/newsroom/financing-the-ai-build-out",
      "accessed_at": "2026-09-28T10:21:20Z",
      "status": "failed",
      "detail": "正文回读超时（400 Timeout fetching），后续打开仍返回Internal Error；未使用搜索摘要中的数值。"
    },
    {
      "query": "Amazon September 14 2026 completed notes",
      "source": "Web Search / SEC EDGAR",
      "accessed_at": "2026-09-28T10:21:20Z",
      "status": "no_results",
      "detail": "未找到足以确认本笔英镑交易实际交割的结果；仅保留定价与预计交割事实。"
    },
    {
      "query": "Amazon September 9 2026 8-K",
      "source": "https://www.sec.gov/Archives/edgar/data/1018724/000101872426000036/amzn-20260908.htm",
      "accessed_at": "2026-09-28T10:21:20Z",
      "status": "success",
      "detail": "原文为董事任命，排除为无关资料；不能作为债券交割确认。"
    }
  ],
  "events": [
    {
      "event_id": "E1",
      "event_time": {
        "value": "2026-09-23",
        "precision": "day"
      },
      "subject": "五家美国 hyperscaler",
      "action": "机构报告累计发行规模",
      "key_fact": "CPRAM报告2026年至今发债约2230亿美元，较2025全年多1170亿美元。",
      "context": "观察是机构统计，不是逐券复算；年内累计的精确截止日未披露。2025全年1060亿美元由2230−1170推算；不是同期间同比。",
      "source_refs": [
        {
          "source_id": "https://cpram.com/lux/en/individual/publications/experts/article/what-impact-is-hyperscaler-bond-issuance-having-on-bond-markets",
          "source_type": "机构原始研究；未取得逐券底表",
          "publisher": "CPRAM",
          "published_at": "2026-09-23"
        },
        {
          "source_id": "sources/webpages/2026-09-28-ai-debt-theme/cpr-source-data.json",
          "source_type": "本次核对的数据摘录；非完整网页副本"
        }
      ],
      "confidence": "medium",
      "key_values": [
        {
          "name": "2026_ytd_issuance",
          "value": 223,
          "unit": "USD billion"
        },
        {
          "name": "excess_over_2025_full_year",
          "value": 117,
          "unit": "USD billion"
        },
        {
          "name": "2025_full_year_derived",
          "value": 106,
          "unit": "USD billion"
        }
      ]
    },
    {
      "event_id": "E2",
      "event_time": {
        "value": "2026-09-23",
        "precision": "day"
      },
      "subject": "五家美国 hyperscaler",
      "action": "机构报告发行期限分布",
      "key_fact": "CPRAM报告2026年其美元债发行约41%集中在20年以上期限，而美国投资级发行整体为15%。",
      "context": "同篇文章的期限分布观察；不同样本的结构比较，不是同一主体历史增速。",
      "source_refs": [
        {
          "source_id": "https://cpram.com/lux/en/individual/publications/experts/article/what-impact-is-hyperscaler-bond-issuance-having-on-bond-markets",
          "source_type": "机构原始研究；未取得逐券底表",
          "publisher": "CPRAM",
          "published_at": "2026-09-23"
        },
        {
          "source_id": "sources/webpages/2026-09-28-ai-debt-theme/cpr-source-data.json",
          "source_type": "本次核对的数据摘录；非完整网页副本"
        }
      ],
      "confidence": "medium"
    },
    {
      "event_id": "E3",
      "event_time": {
        "value": "2026-09-09",
        "precision": "day"
      },
      "subject": "Amazon",
      "action": "披露英镑债券定价条款",
      "key_fact": "四档债券面值合计42.5亿英镑，票息5.200%—6.650%，到期年份2029、2032、2038、2045。",
      "context": "计划9月14日前后交割；本轮未取得最终交割确认。一般公司用途，不等于AI专项；票息不等于含费用和对冲的全口径成本。",
      "source_refs": [
        {
          "source_id": "https://www.sec.gov/Archives/edgar/data/1018724/000110465926107122/tm2624614-3_424b5.htm",
          "source_type": "发行人监管披露；定价文件",
          "publisher": "Amazon / SEC EDGAR",
          "published_at": "2026-09-09"
        },
        {
          "source_id": "sources/webpages/2026-09-28-ai-debt-theme/amzn-source-data.json",
          "source_type": "本次核对的数据摘录；非完整网页副本"
        }
      ],
      "confidence": "high",
      "key_values": [
        {
          "name": "offering_principal",
          "value": 4.25,
          "unit": "GBP billion"
        }
      ]
    },
    {
      "event_id": "E4",
      "event_time": {
        "value": "2026-08-03",
        "precision": "day"
      },
      "subject": "Hyperscaler融资群体",
      "action": "访谈报告年度及年内发行",
      "key_fact": "高盛访谈报告2025全球发债1080亿美元、2026录制时年内累计1940亿美元。",
      "context": "窗口外背景：8月3日录制、8月5日发布。原文是年内累计而非明确上半年；不计算上半年同比，不与CPRAM不同口径金额拼接。",
      "source_refs": [
        {
          "source_id": "https://www.goldmansachs.com/insights/goldman-sachs-exchanges/how-ai-debt-is-reshaping-the-credit-market",
          "source_type": "机构访谈原始转录；录制于2026-08-03",
          "publisher": "Goldman Sachs",
          "published_at": "2026-08-05"
        },
        {
          "source_id": "sources/webpages/2026-09-28-ai-debt-theme/gs-source-data.json",
          "source_type": "本次核对的数据摘录；非完整网页副本"
        }
      ],
      "confidence": "medium"
    },
    {
      "event_id": "E5",
      "event_time": {
        "value": "2026-08-03",
        "precision": "day"
      },
      "subject": "部分大型AI融资的保险客户",
      "action": "交易台报告长端参与人数变化",
      "key_fact": "30年档、订单超过5000万美元的保险客户，从一季度约15家到二季度末约为一半。",
      "context": "窗口外历史观察；属于交易台特定样本，不能解读为全市场需求金额减半或发行失败。",
      "source_refs": [
        {
          "source_id": "https://www.goldmansachs.com/insights/goldman-sachs-exchanges/how-ai-debt-is-reshaping-the-credit-market",
          "source_type": "机构访谈原始转录；录制于2026-08-03",
          "publisher": "Goldman Sachs",
          "published_at": "2026-08-05"
        },
        {
          "source_id": "sources/webpages/2026-09-28-ai-debt-theme/gs-source-data.json",
          "source_type": "本次核对的数据摘录；非完整网页副本"
        }
      ],
      "confidence": "medium"
    },
    {
      "event_id": "E6",
      "event_time": {
        "value": "2026-08-03",
        "precision": "day"
      },
      "subject": "部分大型hyperscaler新券",
      "action": "交易台报告发行溢价变化",
      "key_fact": "此前约2—3bp的新券溢价，在一笔大型交易达到20bp。",
      "context": "窗口外历史观察；未披露交易身份及精确日期，单笔极值不是行业平均，不能当当前新券定价。",
      "source_refs": [
        {
          "source_id": "https://www.goldmansachs.com/insights/goldman-sachs-exchanges/how-ai-debt-is-reshaping-the-credit-market",
          "source_type": "机构访谈原始转录；录制于2026-08-03",
          "publisher": "Goldman Sachs",
          "published_at": "2026-08-05"
        },
        {
          "source_id": "sources/webpages/2026-09-28-ai-debt-theme/gs-source-data.json",
          "source_type": "本次核对的数据摘录；非完整网页副本"
        }
      ],
      "confidence": "medium"
    },
    {
      "event_id": "E7",
      "event_time": {
        "value": "2026-09-03",
        "precision": "day"
      },